{"archive_bundles":[{"paths":["truth/kden_tmax/v1/adopted_stage5r1/source_evidence/sealed/afos/pil=CLIDEN/year=2025/products.zip","truth/kden_tmax/v1/adopted_stage5r1/source_evidence/sealed/afos/pil=CLIDEN/year=2025/product_index.json","truth/kden_tmax/v1/adopted_stage5r1/source_evidence/sealed/afos/pil=CLIDEN/year=2025/products.meta.json"],"pil":"CLIDEN","present":true,"year":2025},{"paths":["truth/kden_tmax/v1/adopted_stage5r1/source_evidence/sealed/afos/pil=CLIDEN/year=2026/products.zip","truth/kden_tmax/v1/adopted_stage5r1/source_evidence/sealed/afos/pil=CLIDEN/year=2026/product_index.json","truth/kden_tmax/v1/adopted_stage5r1/source_evidence/sealed/afos/pil=CLIDEN/year=2026/products.meta.json"],"pil":"CLIDEN","present":true,"year":2026},{"paths":["truth/kden_tmax/v1/adopted_stage5r1/source_evidence/sealed/afos/pil=CF6DEN/year=2025/products.zip","truth/kden_tmax/v1/adopted_stage5r1/source_evidence/sealed/afos/pil=CF6DEN/year=2025/product_index.json","truth/kden_tmax/v1/adopted_stage5r1/source_evidence/sealed/afos/pil=CF6DEN/year=2025/products.meta.json"],"pil":"CF6DEN","present":true,"year":2025},{"paths":["truth/kden_tmax/v1/adopted_stage5r1/source_evidence/sealed/afos/pil=CF6DEN/year=2026/products.zip","truth/kden_tmax/v1/adopted_stage5r1/source_evidence/sealed/afos/pil=CF6DEN/year=2026/product_index.json","truth/kden_tmax/v1/adopted_stage5r1/source_evidence/sealed/afos/pil=CF6DEN/year=2026/products.meta.json"],"pil":"CF6DEN","present":true,"year":2026}],"audit_payloads":[{"audit_path":"truth/kden_tmax/v1/adopted_stage5r1/source_evidence/sealed/audit/year=2025/date=2025-09-07/audit.json","present":true,"size_bytes":20430,"target_date":"2025-09-07"},{"audit_path":"truth/kden_tmax/v1/adopted_stage5r1/source_evidence/sealed/audit/year=2025/date=2025-09-08/audit.json","present":true,"size_bytes":20528,"target_date":"2025-09-08"},{"audit_path":"truth/kden_tmax/v1/adopted_stage5r1/source_evidence/sealed/audit/year=2025/date=2025-09-09/audit.json","present":true,"size_bytes":19660,"target_date":"2025-09-09"},{"audit_path":"truth/kden_tmax/v1/adopted_stage5r1/source_evidence/sealed/audit/year=2025/date=2025-09-10/audit.json","present":true,"size_bytes":19975,"target_date":"2025-09-10"},{"audit_path":"truth/kden_tmax/v1/adopted_stage5r1/source_evidence/sealed/audit/year=2025/date=2025-09-11/audit.json","present":true,"size_bytes":19006,"target_date":"2025-09-11"},{"audit_path":"truth/kden_tmax/v1/adopted_stage5r1/source_evidence/sealed/audit/year=2025/date=2025-09-12/audit.json","present":true,"size_bytes":17751,"target_date":"2025-09-12"},{"audit_path":"truth/kden_tmax/v1/adopted_stage5r1/source_evidence/sealed/audit/year=2025/date=2025-09-13/audit.json","present":true,"size_bytes":17825,"target_date":"2025-09-13"},{"audit_path":"truth/kden_tmax/v1/adopted_stage5r1/source_evidence/sealed/audit/year=2025/date=2025-09-14/audit.json","present":true,"size_bytes":18113,"target_date":"2025-09-14"},{"audit_path":"truth/kden_tmax/v1/adopted_stage5r1/source_evidence/sealed/audit/year=2025/date=2025-09-15/audit.json","present":true,"size_bytes":16741,"target_date":"2025-09-15"},{"audit_path":"truth/kden_tmax/v1/adopted_stage5r1/source_evidence/sealed/audit/year=2025/date=2025-09-16/audit.json","present":true,"size_bytes":15798,"target_date":"2025-09-16"},{"audit_path":"truth/kden_tmax/v1/adopted_stage5r1/source_evidence/sealed/audit/year=2025/date=2025-09-17/audit.json","present":true,"size_bytes":15608,"target_date":"2025-09-17"},{"audit_path":"truth/kden_tmax/v1/adopted_stage5r1/source_evidence/sealed/audit/year=2025/date=2025-09-18/audit.json","present":true,"size_bytes":15030,"target_date":"2025-09-18"},{"audit_path":"truth/kden_tmax/v1/adopted_stage5r1/source_evidence/sealed/audit/year=2025/date=2025-09-19/audit.json","present":true,"size_bytes":14286,"target_date":"2025-09-19"},{"audit_path":"truth/kden_tmax/v1/adopted_stage5r1/source_evidence/sealed/audit/year=2025/date=2025-09-20/audit.json","present":true,"size_bytes":14181,"target_date":"2025-09-20"},{"audit_path":"truth/kden_tmax/v1/adopted_stage5r1/source_evidence/sealed/audit/year=2025/date=2025-09-21/audit.json","present":true,"size_bytes":13292,"target_date":"2025-09-21"},{"audit_path":"truth/kden_tmax/v1/adopted_stage5r1/source_evidence/sealed/audit/year=2025/date=2025-09-22/audit.json","present":true,"size_bytes":12742,"target_date":"2025-09-22"},{"audit_path":"truth/kden_tmax/v1/adopted_stage5r1/source_evidence/sealed/audit/year=2025/date=2025-09-23/audit.json","present":true,"size_bytes":11143,"target_date":"2025-09-23"},{"audit_path":"truth/kden_tmax/v1/adopted_stage5r1/source_evidence/sealed/audit/year=2025/date=2025-09-24/audit.json","present":true,"size_bytes":11924,"target_date":"2025-09-24"},{"audit_path":"truth/kden_tmax/v1/adopted_stage5r1/source_evidence/sealed/audit/year=2025/date=2025-09-25/audit.json","present":true,"size_bytes":11054,"target_date":"2025-09-25"},{"audit_path":"truth/kden_tmax/v1/adopted_stage5r1/source_evidence/sealed/audit/year=2025/date=2025-09-26/audit.json","present":true,"size_bytes":10680,"target_date":"2025-09-26"},{"audit_path":"truth/kden_tmax/v1/adopted_stage5r1/source_evidence/sealed/audit/year=2025/date=2025-09-27/audit.json","present":true,"size_bytes":10510,"target_date":"2025-09-27"},{"audit_path":"truth/kden_tmax/v1/adopted_stage5r1/source_evidence/sealed/audit/year=2025/date=2025-09-28/audit.json","present":true,"size_bytes":10542,"target_date":"2025-09-28"},{"audit_path":"truth/kden_tmax/v1/adopted_stage5r1/source_evidence/sealed/audit/year=2025/date=2025-09-29/audit.json","present":true,"size_bytes":9863,"target_date":"2025-09-29"},{"audit_path":"truth/kden_tmax/v1/adopted_stage5r1/source_evidence/sealed/audit/year=2025/date=2025-09-30/audit.json","present":true,"size_bytes":8442,"target_date":"2025-09-30"},{"audit_path":"truth/kden_tmax/v1/adopted_stage5r1/source_evidence/sealed/audit/year=2025/date=2025-10-01/audit.json","present":true,"size_bytes":23975,"target_date":"2025-10-01"},{"audit_path":"truth/kden_tmax/v1/adopted_stage5r1/source_evidence/sealed/audit/year=2025/date=2025-10-02/audit.json","present":true,"size_bytes":23382,"target_date":"2025-10-02"},{"audit_path":"truth/kden_tmax/v1/adopted_stage5r1/source_evidence/sealed/audit/year=2025/date=2025-10-03/audit.json","present":true,"size_bytes":22662,"target_date":"2025-10-03"},{"audit_path":"truth/kden_tmax/v1/adopted_stage5r1/source_evidence/sealed/audit/year=2025/date=2025-10-04/audit.json","present":true,"size_bytes":23961,"target_date":"2025-10-04"},{"audit_path":"truth/kden_tmax/v1/adopted_stage5r1/source_evidence/sealed/audit/year=2025/date=2025-10-05/audit.json","present":true,"size_bytes":21750,"target_date":"2025-10-05"},{"audit_path":"truth/kden_tmax/v1/adopted_stage5r1/source_evidence/sealed/audit/year=2025/date=2025-10-06/audit.json","present":true,"size_bytes":20815,"target_date":"2025-10-06"},{"audit_path":"truth/kden_tmax/v1/adopted_stage5r1/source_evidence/sealed/audit/year=2025/date=2025-10-07/audit.json","present":true,"size_bytes":20747,"target_date":"2025-10-07"},{"audit_path":"truth/kden_tmax/v1/adopted_stage5r1/source_evidence/sealed/audit/year=2025/date=2025-10-08/audit.json","present":true,"size_bytes":20718,"target_date":"2025-10-08"},{"audit_path":"truth/kden_tmax/v1/adopted_stage5r1/source_evidence/sealed/audit/year=2025/date=2025-10-09/audit.json","present":true,"size_bytes":20353,"target_date":"2025-10-09"},{"audit_path":"truth/kden_tmax/v1/adopted_stage5r1/source_evidence/sealed/audit/year=2025/date=2025-10-10/audit.json","present":true,"size_bytes":19157,"target_date":"2025-10-10"},{"audit_path":"truth/kden_tmax/v1/adopted_stage5r1/source_evidence/sealed/audit/year=2025/date=2025-10-11/audit.json","present":true,"size_bytes":17674,"target_date":"2025-10-11"},{"audit_path":"truth/kden_tmax/v1/adopted_stage5r1/source_evidence/sealed/audit/year=2025/date=2025-10-12/audit.json","present":true,"size_bytes":18520,"target_date":"2025-10-12"},{"audit_path":"truth/kden_tmax/v1/adopted_stage5r1/source_evidence/sealed/audit/year=2025/date=2025-10-13/audit.json","present":true,"size_bytes":17696,"target_date":"2025-10-13"},{"audit_path":"truth/kden_tmax/v1/adopted_stage5r1/source_evidence/sealed/audit/year=2025/date=2025-10-14/audit.json","present":true,"size_bytes":18258,"target_date":"2025-10-14"},{"audit_path":"truth/kden_tmax/v1/adopted_stage5r1/source_evidence/sealed/audit/year=2025/date=2025-10-15/audit.json","present":true,"size_bytes":17006,"target_date":"2025-10-15"},{"audit_path":"truth/kden_tmax/v1/adopted_stage5r1/source_evidence/sealed/audit/year=2025/date=2025-10-16/audit.json","present":true,"size_bytes":16995,"target_date":"2025-10-16"},{"audit_path":"truth/kden_tmax/v1/adopted_stage5r1/source_evidence/sealed/audit/year=2025/date=2025-10-17/audit.json","present":true,"size_bytes":16672,"target_date":"2025-10-17"},{"audit_path":"truth/kden_tmax/v1/adopted_stage5r1/source_evidence/sealed/audit/year=2025/date=2025-10-18/audit.json","present":true,"size_bytes":15985,"target_date":"2025-10-18"},{"audit_path":"truth/kden_tmax/v1/adopted_stage5r1/source_evidence/sealed/audit/year=2025/date=2025-10-19/audit.json","present":true,"size_bytes":15848,"target_date":"2025-10-19"},{"audit_path":"truth/kden_tmax/v1/adopted_stage5r1/source_evidence/sealed/audit/year=2025/date=2025-10-20/audit.json","present":true,"size_bytes":13787,"target_date":"2025-10-20"},{"audit_path":"truth/kden_tmax/v1/adopted_stage5r1/source_evidence/sealed/audit/year=2025/date=2025-10-21/audit.json","present":true,"size_bytes":13338,"target_date":"2025-10-21"},{"audit_path":"truth/kden_tmax/v1/adopted_stage5r1/source_evidence/sealed/audit/year=2025/date=2025-10-22/audit.json","present":true,"size_bytes":13481,"target_date":"2025-10-22"},{"audit_path":"truth/kden_tmax/v1/adopted_stage5r1/source_evidence/sealed/audit/year=2025/date=2025-10-23/audit.json","present":true,"size_bytes":13441,"target_date":"2025-10-23"},{"audit_path":"truth/kden_tmax/v1/adopt